<?xml version="1.0" encoding="UTF-8"?>
<dataroot xmlns:od="urn:schemas-microsoft-com:officedata" xmlns:xsi="http://www.w3.org/2001/XMLSchema-instance"  xsi:noNamespaceSchemaLocation="Tproteindata.xsd" generated="2020-01-12T15:44:29">
<Tproteindata>
<ID>1</ID>
<ProtName>02811</ProtName>
<EXT>33935</EXT>
<MW_x0020__x0028_Da_x0029_>33157</MW_x0020__x0028_Da_x0029_>
<Plasmid>pET-46</Plasmid>
<Plasmid_x0020_Resistance>AMP</Plasmid_x0020_Resistance>
<AA_x0020_seq>MAHHHHHHVDDDDKMNSDDNADGLIFSPLPQNKNTVVRHYSNEQEMPNLSQMAQRTIDFPTQIVRVSGNLTGLELSCDDVENEIDQVFSKKISPNLFTYNTYVSCGYDVNDPEQHATNFSIQSYFDPLTDNAVDYLKSYLKEYNGYNLFNTTTLQIENAKGIIVSMNLNAGLKSNPDKTPFTLYRQDRNNFYFKSNFDVRKELISDIYQRFYSNDPDMILPFFDKWIFSYAGSVYYSILMASNYLELQPERIFVMENEGDIFVSDLRYYFANLCMKRNPNKHCL</AA_x0020_seq>
<AA_x0020_num>284</AA_x0020_num>
<Hydrophobicity>-0.576</Hydrophobicity>
<Aliphatics>72</Aliphatics>
<Instability>39</Instability>
<Pi>5</Pi>
</Tproteindata>
<Tproteindata>
<ID>2</ID>
<ProtName>10421</ProtName>
<EXT>46388</EXT>
<MW_x0020__x0028_Da_x0029_>44247</MW_x0020__x0028_Da_x0029_>
<Plasmid>pET-46</Plasmid>
<Plasmid_x0020_Resistance>AMP</Plasmid_x0020_Resistance>
<AA_x0020_seq>MAHHHHHHVDDDDKMFTLPRQPTKSYECENCSQLSRENLHDKWEITNEPLNNNISNVRRSYGYKERISLEQLQRGVIISTLAPGAVVRITPLQNKSIPELLIKTPKNQLLPLKEASSLYNQDDEVGNNPLAITKHQAMLQIKPELGYGKFILKSKDITNKYADAYMISVLDKFSITYLEVETDSLHYQYGDKLKATISLHNDITEYDVNDVDARLVGPKGQVISLNLTKLKSNVFEGTATLDSELNDRGENWYLETDVQTEYGQEIIRRSGHTAFSYSIPSASLMNVKKLSSKPLTFVVTVDVATASRYALQSVLFQKNGKGEARPIQTSQRAQWLEPGKHVLQFTFDNHNQLSDDNLYLGYLRLIDYGQLKTVYQYNQPVKLSQLVD</AA_x0020_seq>
<AA_x0020_num>388</AA_x0020_num>
<Hydrophobicity>-0.551</Hydrophobicity>
<Aliphatics>90</Aliphatics>
<Instability>32</Instability>
<Pi>6</Pi>
</Tproteindata>
<Tproteindata>
<ID>3</ID>
<ProtName>13951</ProtName>
<EXT>14105</EXT>
<MW_x0020__x0028_Da_x0029_>13312</MW_x0020__x0028_Da_x0029_>
<Plasmid>pET-46</Plasmid>
<Plasmid_x0020_Resistance>AMP</Plasmid_x0020_Resistance>
<AA_x0020_seq>MAHHHHHHVDDDDKMEDTANPNEMTKDAWLNSMTPLLPDLICKGFIQDPDLKKRFDEIKMTYEQCVTLIPESTKKCQDELYASMPDKINSETAGTWGRSLGECIGKDFAEKHLIPK</AA_x0020_seq>
<AA_x0020_num>116</AA_x0020_num>
<Hydrophobicity>-0.795</Hydrophobicity>
<Aliphatics>64</Aliphatics>
<Instability>30</Instability>
<Pi>5</Pi>
</Tproteindata>
<Tproteindata>
<ID>4</ID>
<ProtName>18401</ProtName>
<EXT>17437</EXT>
<MW_x0020__x0028_Da_x0029_>13414</MW_x0020__x0028_Da_x0029_>
<Plasmid>pET-46</Plasmid>
<Plasmid_x0020_Resistance>AMP</Plasmid_x0020_Resistance>
<AA_x0020_seq>MAHHHHHHVDDDDKMAPAYLTTHNRTGEESNAYIAGSIPSLYPTAAYSTNQVYWNLVRLACYGHTTNGQCPALIKMATNTANPIDIGYVTMDLNTGDITPKTLSAKGYSLRVIGPGEAEITKN</AA_x0020_seq>
<AA_x0020_num>123</AA_x0020_num>
<Hydrophobicity>-0.43</Hydrophobicity>
<Aliphatics>73</Aliphatics>
<Instability>21</Instability>
<Pi>6</Pi>
</Tproteindata>
<Tproteindata>
<ID>5</ID>
<ProtName>18641</ProtName>
<EXT>4533</EXT>
<MW_x0020__x0028_Da_x0029_>14905</MW_x0020__x0028_Da_x0029_>
<Plasmid>pET-46</Plasmid>
<Plasmid_x0020_Resistance>AMP</Plasmid_x0020_Resistance>
<AA_x0020_seq>MAHHHHHHVDDDDKMAVELKTFQNIVDAIAEGKRISFVINLKKCTSEMPLNSAIVSVTPNAVMVVGDSRVTASDRHFTLDDPVARGTPMFDYSKFNLDSEGDASIKTTVLNASSYERLGSYQMNCKLGDGFKVFG</AA_x0020_seq>
<AA_x0020_num>135</AA_x0020_num>
<Hydrophobicity>-0.276</Hydrophobicity>
<Aliphatics>76</Aliphatics>
<Instability>23</Instability>
<Pi>6</Pi>
</Tproteindata>
<Tproteindata>
<ID>6</ID>
<ProtName>BSA</ProtName>
<EXT>49915</EXT>
<MW_x0020__x0028_Da_x0029_>34234</MW_x0020__x0028_Da_x0029_>
<AA_x0020_seq>MKWVTFISLLLLFSSAYSRGVFRRDTHKSEIAHRFKDLGEEHFKGLVLIAFSQYLQQCPFDEHVKLVNELTEFAKTCVADESHAGCEKSLHTLFGDELCKVASLRETYGDMADCCEKQEPERNECFLSHKDDSPDLPKLKPDPNTLCDEFKADEKKFWGKYLYEIARRHPYFYAPELLYYANKYNGVFQECCQAEDKGACLLPKIETMREKVLASSARQRLRCASIQKFGERALKAWSVARLSQKFPKAEFVEVTKLVTDLTKVHKECCHGDLLECADDRADLAKYICDNQDTISSKLKECCDKPLLEKSHCIAEVEKDAIPENLPPLTADFAEDKDVCKNYQEAKDAFLGSFLYEYSRRHPEYAVSVLLRLAKEYEATLEECCAKDDPHACYSTVFDKLKHLVDEPQNLIKQNCDQFEKLGEYGFQNALIVRYTRKVPQVSTPTLVEVSRSLGKVGTRCCTKPESERMPCTEDYLSLILNRLCVLHEKTPVSEKVTKCCTESLVNRRPCFSALTPDETYVPKAFDEKLFTFHADICTLPDTEKQIKKQTALVELLKHKPKATEEQLKTVMENFVAFVDKCCAADDKEACFAVEGPKLVVSTQTALA</AA_x0020_seq>
<AA_x0020_num>607</AA_x0020_num>
<Hydrophobicity>-0.429</Hydrophobicity>
<Aliphatics>77</Aliphatics>
<Instability>40</Instability>
<Pi>6</Pi>
</Tproteindata>
<Tproteindata>
<ID>7</ID>
<ProtName>C1QBP</ProtName>
<EXT>24325</EXT>
<MW_x0020__x0028_Da_x0029_>31776</MW_x0020__x0028_Da_x0029_>
<Plasmid>pET-46</Plasmid>
<Plasmid_x0020_Resistance>AMP</Plasmid_x0020_Resistance>
<AA_x0020_seq>MAHHHHHHVDDDDKMLPLLRCVPRVLGSSVAGLRAAAPASPFRQLLQPAPRLCTRPFGLLSVRAGSERRPGLLRPRGPCACGCGCGSLHTDGDKAFVDFLSDEIKEERKIQKHKTLPKMSGGWELELNGTESKLVRKVAGEKITVTFNINNSIPPTFDGEEEPSQGQKVEEQEPELTSTPNFVVEVIKNDDGKKALVLDCHYPEDEVGQEDEAESDIFSIREVSFQSTGESEWKDTNYTLNTYSLDWALYDHLMDFLADRGVDNTFADELVELSTALEAPGAHYFS</AA_x0020_seq>
<AA_x0020_num>286</AA_x0020_num>
<Hydrophobicity>-0.526</Hydrophobicity>
<Aliphatics>75</Aliphatics>
<Instability>48</Instability>
<Pi>5</Pi>
</Tproteindata>
<Tproteindata>
<ID>8</ID>
<ProtName>C1QBP-GST</ProtName>
<EXT>22460</EXT>
<MW_x0020__x0028_Da_x0029_>31362</MW_x0020__x0028_Da_x0029_>
<Plasmid>pANT7_cGST</Plasmid>
<Plasmid_x0020_Resistance>AMP</Plasmid_x0020_Resistance>
<AA_x0020_seq>MLPLLRCVPRVLGSSVAGLRAAAPASPFRQLLQPAPRLCTRPFGLLSVRAGSERRPGLLRPRGPCACGCGCGSLHTDGDKAFVDFLSDEIKEERKIQKHKTLPKMSGGWELELNGTEAKLVRKVAGEKITVTFNINNSIPPTFDGEEEPSQGQKVEEQEPELTSTPNFVVEVIKNDDGKKALVLDCHYPEDEVGQEDEAESDIFSIREVSFQSTGESEWKDTNYTLNTDSLDWALYDHLMDFLADRGVDNTFADELVELSTALEHQEYITFLEDLKSFVKSQ</AA_x0020_seq>
<AA_x0020_num>282</AA_x0020_num>
<Hydrophobicity>-0.461</Hydrophobicity>
<Aliphatics>80</Aliphatics>
<Instability>49</Instability>
<Pi>5</Pi>
</Tproteindata>
<Tproteindata>
<ID>9</ID>
<ProtName>ChiA_Full</ProtName>
<EXT>100325</EXT>
<MW_x0020__x0028_Da_x0029_>82603</MW_x0020__x0028_Da_x0029_>
<Plasmid>pET-46</Plasmid>
<Plasmid_x0020_Resistance>AMP</Plasmid_x0020_Resistance>
<AA_x0020_seq>MAHHHHHHVDDDDKMNTSLKPSIAQPTACVNSLFTATGNQHWKSIVLKLTNNCNQAVDFQNSTVSFQTTAALNTSFWGDFSPLSYPDNALNISSQPQSGGNYLATLNLHFPSYPGANSKLPVGSSISIKYGAVTDSHIEGTANVYLSTTVESGSIQLINAAAKPTNVSQGYALVHVTMNGQSVSDVQLPWETSKTLSGFAAGNYAISAETVTDSNGNLYLGQANPSMVNVIANQTTSSTINYARVQETGKIKIHVQNLPGELSNYNENPTVLITQSQSGNSRSQHAVWGNTTTVAELKEGSSYQFSTPAIQYNDYNCWPTFTPSSLVASAANVPTTNLTYQCAQIVKDNVTINVSGAPSSLASLKIILTPNDGSQTVEQTIDLANGVGSSAISLTDGVIYTLSSEGVPGYTVQFSPQPLTATENATVNITLSPVTAAKGRIIGYVPGWKTPPAAQELASAGYTHVMIAFGVFSTNTPGVIVPAFETITKEYIQSLHQAGIKVILSLGGALTSIPNTTVDFHQVLVASSSPEAFKQTFINSLKELISQYGFDGFDTDIEHGINASGSFSQPQGDIAVLASIINTMYSQNSSLLITLTPQVANIAATSGFDQTWGNYASLIMQTHQSLAWVGIQLYNTGCAFGIDQVCYGPTPTDTPDFSVAMATDLLENWPATVNGRPTGFQPYISYLRPSQIVIGYPSPNASGGSDGSPVTPTTTIKRAIQCLKTAIAGNTSCGVYVPPRAYGNIGGVFNWEVTYDKNNQFKFAKELKNCAINGVCE</AA_x0020_seq>
<AA_x0020_num>777</AA_x0020_num>
<Hydrophobicity>-0.106</Hydrophobicity>
<Aliphatics>82</Aliphatics>
<Instability>30</Instability>
<Pi>5</Pi>
</Tproteindata>
<Tproteindata>
<ID>10</ID>
<ProtName>ChiA_N1</ProtName>
<EXT>18450</EXT>
<MW_x0020__x0028_Da_x0029_>16664</MW_x0020__x0028_Da_x0029_>
<Plasmid>pET-46</Plasmid>
<Plasmid_x0020_Resistance>AMP</Plasmid_x0020_Resistance>
<AA_x0020_seq>MAHHHHHHVDDDDKMNTSLKPSIAQPTACVNSLFTATGNQHWKSIVLKLTNNCNQAVDFQNSTVSFQTTAALNTSFWGDFSPLSYPDNALNISSQPQSGGNYLATLNLHFPSYPGANSKLPVGSSISIKYGAVTDSHIEGTANVYLSTTVESGSI</AA_x0020_seq>
<AA_x0020_num>155</AA_x0020_num>
<Hydrophobicity>-0.322</Hydrophobicity>
<Aliphatics>72</Aliphatics>
<Instability>29</Instability>
<Pi>6</Pi>
</Tproteindata>
<Tproteindata>
<ID>11</ID>
<ProtName>ChiA_N2</ProtName>
<EXT>12950</EXT>
<MW_x0020__x0028_Da_x0029_>14547</MW_x0020__x0028_Da_x0029_>
<Plasmid>pET-46</Plasmid>
<Plasmid_x0020_Resistance>AMP</Plasmid_x0020_Resistance>
<AA_x0020_seq>MAHHHHHHVDDDDKMGSIQLINAAAKPTNVSQGYALVHVTMNGQSVSDVQLPWETSKTLSGFAAGNYAISAETVTDSNGNLYLGQANPSMVNVIANQTTSSTINYARVQETGKIKIHVQNLPGELSNYNENPTVLITQSQSGNSRSQHAVWGNTTTVAELKEGSSYQFSTPAIQYND</AA_x0020_seq>
<AA_x0020_num>177</AA_x0020_num>
<Hydrophobicity>-0.505</Hydrophobicity>
<Aliphatics>73</Aliphatics>
<Instability>25</Instability>
<Pi>6</Pi>
</Tproteindata>
<Tproteindata>
<ID>12</ID>
<ProtName>ChiA_N3</ProtName>
<EXT>14440</EXT>
<MW_x0020__x0028_Da_x0029_>15699</MW_x0020__x0028_Da_x0029_>
<Plasmid>pET-46</Plasmid>
<Plasmid_x0020_Resistance>AMP</Plasmid_x0020_Resistance>
<AA_x0020_seq>MAHHHHHHVDDDDKMGSSYQFSTPAIQYNDYNCWPTFTPSSLVASAANVPTTNLTYQCAQIVKDNVTINVSGAPSSLASLKIILTPNDGSQTVEQTIDLANGVGSSAISLTDGVIYTLSSEGVPGYTVQFSPQPLTATENATVNITLS</AA_x0020_seq>
<AA_x0020_num>148</AA_x0020_num>
<Hydrophobicity>-0.141</Hydrophobicity>
<Aliphatics>82</Aliphatics>
<Instability>33</Instability>
<Pi>5</Pi>
</Tproteindata>
<Tproteindata>
<ID>13</ID>
<ProtName>LapA</ProtName>
<EXT>54110</EXT>
<MW_x0020__x0028_Da_x0029_>44146</MW_x0020__x0028_Da_x0029_>
</Tproteindata>
<Tproteindata>
<ID>14</ID>
<ProtName>LapA_dN</ProtName>
<EXT>7575</EXT>
<MW_x0020__x0028_Da_x0029_>12992</MW_x0020__x0028_Da_x0029_>
</Tproteindata>
<Tproteindata>
<ID>15</ID>
<ProtName>LapB</ProtName>
<EXT>49070</EXT>
<MW_x0020__x0028_Da_x0029_>43984</MW_x0020__x0028_Da_x0029_>
</Tproteindata>
<Tproteindata>
<ID>16</ID>
<ProtName>LCL full</ProtName>
<EXT>40450</EXT>
<MW_x0020__x0028_Da_x0029_>56423</MW_x0020__x0028_Da_x0029_>
<Plasmid>pET-46</Plasmid>
<Plasmid_x0020_Resistance>AMP</Plasmid_x0020_Resistance>
<AA_x0020_seq>MAHHHHHHVDDDDKMKSNPASQAYVDGKVSELKNELTNKINSIPSGPQGPRGDKGEAGPKGDRGEAGPQGLPGPKGDRGEAGPQGLPGPKGDRGEAGPQGLPGPKGDRGEAGPQGLPGPKGDRGEAGPQGLPGPQGLPGPKGDKGEAGPQGLPGPKGDKGEAGPQGLPGPKGDKGEAGAVGPQGMPGPKGDKEAGPQGLPGPKGDRGEAGPQGLPGPKGDRGEAGPQGLPGPKGDRGEAGPQGLPGPKGDRGEAGPQGLPGPKGDRGEAGPQGLPGPKGDRGEAGPQGLPGPKGDRGEAGPQGLPGPKGDRGEAGPQGLPGPKGDRGEAGPQGLPGPKGDRGEAGPQGLPGPKGDRGEAGPQGLPGPKGDRGEAGPQGLPGPKGDKGETGAVGPQGMPGPKGEAGDDGQGVPAGGETGQVLAKSNDLDFNTMWVDPANSGIRRQLGDKALGGTVIYVNALGTHGLVVANSDQVNSNTWWDAQDSITNPAHFDNEGKLYSDWRLPTRFELNLIYMMRNELGNFLAGNYWSSIEKSSANSWVFNSKTGEIKDIAKSKTAAVRAVRAF</AA_x0020_seq>
<AA_x0020_num>565</AA_x0020_num>
<Hydrophobicity>-1.042</Hydrophobicity>
<Aliphatics>46</Aliphatics>
<Instability>16</Instability>
<Pi>6</Pi>
</Tproteindata>
<Tproteindata>
<ID>17</ID>
<ProtName>Lcl-C</ProtName>
<EXT>38960</EXT>